{
  "$schema": "http://json-schema.org/draft-04/schema#",
  "$id": "https://raw.githubusercontent.com/umccr/orcabus/main/docs/schemas/events/sequencerunmanager/SequenceRunSampleSheetUpdate.schema.json",
  "description": "EventBridge custom event schema for orcabus.sequencerunmanager@SequenceRunSampleSheetUpdate",
  "title": "AWSEvent",
  "definitions": {
    "SequenceRunSampleSheetUpdate": {
      "type": "object",
      "required": ["instrumentRunId", "timeStamp", "sampleSheetName", "samplesheetBase64gz"],
      "properties": {
        "id": {
          "type": "string"
        },
        "version": {
          "type": "string"
        },
        "instrumentRunId": {
          "type": "string"
        },
        "sequenceRunId": {
          "type": "string"
        },
        "timeStamp": {
          "type": "string",
          "format": "date-time"
        },
        "sampleSheetName": {
          "type": "string"
        },
        "samplesheetBase64gz": {
          "type": "string"
        },
        "comment": {
          "$ref": "#/definitions/Comment"
        }
      }
    },
    "Comment": {
      "type": "object",
      "required": ["comment", "createdBy"],
      "properties": {
        "comment": {
          "type": "string"
        },
        "createdBy": {
          "type": "string"
        }
      }
    }
  },
  "type": "object",
  "properties": {
    "id": {
      "type": "string"
    },
    "region": {
      "type": "string"
    },
    "resources": {
      "type": "array",
      "items": {
        "type": "string"
      }
    },
    "source": {
      "type": "string"
    },
    "time": {
      "format": "date-time",
      "type": "string"
    },
    "version": {
      "type": "string"
    },
    "account": {
      "type": "string"
    },
    "detail-type": {
      "type": "string"
    },
    "detail": {
      "$ref": "#/definitions/SequenceRunSampleSheetUpdate"
    }
  },
  "required": ["detail", "detail-type", "source"]
}
